{
  "packVersion": 1,
  "packId": "display-fatigue-001",
  "title": "Display Fatigue 001",
  "generatedBy": "claude-opus-4-7",
  "generatedAt": "2026-05-16",
  "targetProfile": "Display-optimized short tiredness / mild grumbling phrases — the things you mutter when running low. 4-14 chars. Mostly カジュアル.",
  "reviewStatus": "reviewed",
  "sentences": [
    { "externalId": "s001", "japanese": "疲れた。", "tokens": [{ "text": "疲れた", "kana": "つかれた" }, { "text": "。" }], "kana": "つかれた", "chinese": "累了。", "category": "smalltalk", "register": "カジュアル", "difficulty": 1, "frequencyRank": 999, "chunkPattern": "疲れた", "tags": ["display", "fatigue", "tired"] },
    { "externalId": "s002", "japanese": "もう限界。", "tokens": [{ "text": "もう" }, { "text": "限界", "kana": "げんかい" }, { "text": "。" }], "kana": "もうげんかい", "chinese": "已经到极限了。", "category": "smalltalk", "register": "カジュアル", "difficulty": 1, "frequencyRank": 990, "chunkPattern": "もう限界", "tags": ["display", "fatigue", "limit"] },
    { "externalId": "s003", "japanese": "だるい。", "tokens": [{ "text": "だるい。" }], "kana": "だるい", "chinese": "好没劲。", "category": "smalltalk", "register": "カジュアル", "difficulty": 1, "frequencyRank": 994, "chunkPattern": "だるい", "tags": ["display", "fatigue", "sluggish"] },
    { "externalId": "s004", "japanese": "今日は長かった。", "tokens": [{ "text": "今日", "kana": "きょう" }, { "text": "は" }, { "text": "長かった", "kana": "ながかった" }, { "text": "。" }], "kana": "きょうはながかった", "chinese": "今天好漫长。", "category": "smalltalk", "register": "カジュアル", "difficulty": 1, "frequencyRank": 986, "chunkPattern": "今日は〜かった", "tags": ["display", "fatigue", "long-day"] },
    { "externalId": "s005", "japanese": "早く帰りたい。", "tokens": [{ "text": "早く", "kana": "はやく" }, { "text": "帰りたい", "kana": "かえりたい" }, { "text": "。" }], "kana": "はやくかえりたい", "chinese": "想早点回家。", "category": "smalltalk", "register": "カジュアル", "difficulty": 1, "frequencyRank": 992, "chunkPattern": "早く〜たい", "tags": ["display", "fatigue", "go-home"] },
    { "externalId": "s006", "japanese": "もう何もしたくない。", "tokens": [{ "text": "もう" }, { "text": "何も", "kana": "なにも" }, { "text": "したくない。" }], "kana": "もうなにもしたくない", "chinese": "什么都不想做了。", "category": "smalltalk", "register": "カジュアル", "difficulty": 2, "frequencyRank": 980, "chunkPattern": "もう何も〜ない", "tags": ["display", "fatigue", "drained"] },
    { "externalId": "s007", "japanese": "頭が回らない。", "tokens": [{ "text": "頭", "kana": "あたま" }, { "text": "が" }, { "text": "回らない", "kana": "まわらない" }, { "text": "。" }], "kana": "あたまがまわらない", "chinese": "脑子转不动了。", "category": "smalltalk", "register": "カジュアル", "difficulty": 2, "frequencyRank": 976, "chunkPattern": "頭が回らない", "tags": ["display", "fatigue", "foggy"] },
    { "externalId": "s008", "japanese": "ちょっと休憩したい。", "tokens": [{ "text": "ちょっと" }, { "text": "休憩", "kana": "きゅうけい" }, { "text": "したい。" }], "kana": "ちょっときゅうけいしたい", "chinese": "想休息一下。", "category": "smalltalk", "register": "カジュアル", "difficulty": 1, "frequencyRank": 984, "chunkPattern": "ちょっと〜したい", "tags": ["display", "fatigue", "break"] },
    { "externalId": "s009", "japanese": "目がしょぼしょぼする。", "tokens": [{ "text": "目", "kana": "め" }, { "text": "がしょぼしょぼする。" }], "kana": "めがしょぼしょぼする", "chinese": "眼睛干涩。", "category": "smalltalk", "register": "カジュアル", "difficulty": 2, "frequencyRank": 958, "chunkPattern": "目がしょぼしょぼする", "tags": ["display", "fatigue", "eye-strain"] },
    { "externalId": "s010", "japanese": "寝不足だな。", "tokens": [{ "text": "寝不足", "kana": "ねぶそく" }, { "text": "だな。" }], "kana": "ねぶそくだな", "chinese": "睡眠不足啊。", "category": "smalltalk", "register": "カジュアル", "difficulty": 2, "frequencyRank": 970, "chunkPattern": "〜だな", "tags": ["display", "fatigue", "sleep-deprived"] },
    { "externalId": "s011", "japanese": "肩がこってる。", "tokens": [{ "text": "肩", "kana": "かた" }, { "text": "がこってる。" }], "kana": "かたがこってる", "chinese": "肩膀僵了。", "category": "smalltalk", "register": "カジュアル", "difficulty": 2, "frequencyRank": 968, "chunkPattern": "肩がこってる", "tags": ["display", "fatigue", "stiff"] },
    { "externalId": "s012", "japanese": "集中力が切れた。", "tokens": [{ "text": "集中力", "kana": "しゅうちゅうりょく" }, { "text": "が" }, { "text": "切れた", "kana": "きれた" }, { "text": "。" }], "kana": "しゅうちゅうりょくがきれた", "chinese": "注意力断了。", "category": "smalltalk", "register": "カジュアル", "difficulty": 3, "frequencyRank": 962, "chunkPattern": "集中力が切れた", "tags": ["display", "fatigue", "focus-gone"] },
    { "externalId": "s013", "japanese": "やる気が出ない。", "tokens": [{ "text": "やる" }, { "text": "気", "kana": "き" }, { "text": "が" }, { "text": "出ない", "kana": "でない" }, { "text": "。" }], "kana": "やるきがでない", "chinese": "提不起劲。", "category": "smalltalk", "register": "カジュアル", "difficulty": 2, "frequencyRank": 974, "chunkPattern": "やる気が出ない", "tags": ["display", "fatigue", "no-motivation"] },
    { "externalId": "s014", "japanese": "ちょっと疲れがたまってる。", "tokens": [{ "text": "ちょっと" }, { "text": "疲れ", "kana": "つかれ" }, { "text": "がたまってる。" }], "kana": "ちょっとつかれがたまってる", "chinese": "疲劳有点积累了。", "category": "smalltalk", "register": "カジュアル", "difficulty": 2, "frequencyRank": 956, "chunkPattern": "疲れがたまってる", "tags": ["display", "fatigue", "buildup"] },
    { "externalId": "s015", "japanese": "今週は本当に長い。", "tokens": [{ "text": "今週", "kana": "こんしゅう" }, { "text": "は" }, { "text": "本当に", "kana": "ほんとうに" }, { "text": "長い", "kana": "ながい" }, { "text": "。" }], "kana": "こんしゅうはほんとうにながい", "chinese": "这周真长。", "category": "smalltalk", "register": "カジュアル", "difficulty": 2, "frequencyRank": 960, "chunkPattern": "今週は〜長い", "tags": ["display", "fatigue", "long-week"] },
    { "externalId": "s016", "japanese": "もうへとへと。", "tokens": [{ "text": "もうへとへと。" }], "kana": "もうへとへと", "chinese": "已经精疲力尽。", "category": "smalltalk", "register": "カジュアル", "difficulty": 2, "frequencyRank": 966, "chunkPattern": "もうへとへと", "tags": ["display", "fatigue", "exhausted"] },
    { "externalId": "s017", "japanese": "コーヒーが欲しい。", "tokens": [{ "text": "コーヒーが" }, { "text": "欲しい", "kana": "ほしい" }, { "text": "。" }], "kana": "こーひーがほしい", "chinese": "想来杯咖啡。", "category": "smalltalk", "register": "カジュアル", "difficulty": 1, "frequencyRank": 972, "chunkPattern": "〜が欲しい", "tags": ["display", "fatigue", "caffeine"] },
    { "externalId": "s018", "japanese": "早く週末にならないかな。", "tokens": [{ "text": "早く", "kana": "はやく" }, { "text": "週末", "kana": "しゅうまつ" }, { "text": "にならないかな。" }], "kana": "はやくしゅうまつにならないかな", "chinese": "周末快点来吧。", "category": "smalltalk", "register": "カジュアル", "difficulty": 2, "frequencyRank": 964, "chunkPattern": "早く〜にならないかな", "tags": ["display", "fatigue", "weekend-please"] },
    { "externalId": "s019", "japanese": "体が重い。", "tokens": [{ "text": "体", "kana": "からだ" }, { "text": "が" }, { "text": "重い", "kana": "おもい" }, { "text": "。" }], "kana": "からだがおもい", "chinese": "身体沉重。", "category": "smalltalk", "register": "カジュアル", "difficulty": 1, "frequencyRank": 978, "chunkPattern": "体が重い", "tags": ["display", "fatigue", "heavy"] },
    { "externalId": "s020", "japanese": "ちょっと一息つきたい。", "tokens": [{ "text": "ちょっと" }, { "text": "一息", "kana": "ひといき" }, { "text": "つきたい。" }], "kana": "ちょっとひといきつきたい", "chinese": "想喘口气。", "category": "smalltalk", "register": "カジュアル", "difficulty": 2, "frequencyRank": 952, "chunkPattern": "一息つきたい", "tags": ["display", "fatigue", "breather"] }
  ],
  "dialogues": [],
  "passages": []
}
